{
  "id": "konquest_mission_modified_by_contributor",
  "name": "Missão Modificada",
  "category": "konquest",
  "subject": "Uma missão foi modificada",
  "header": {
    "icon": "edit",
    "iconSize": 48,
    "title": "Olá, {{userName}}!",
    "subtitle": null
  },
  "content": {
    "intro": "A missão \"{{missionName}}\" foi modificada por um contribuidor. Confira as atualizações.",
    "sections": [
      {
        "type": "info-card",
        "title": "Detalhes da alteração",
        "items": [
          {
            "icon": "mail",
            "label": "Email do contribuidor",
            "value": "pamela.machado.silva@portoseguro.com.br"
          },
          {
            "icon": "menu_book",
            "label": "Curso",
            "value": "Desentupimento"
          }
        ]
      }
    ],
    "cta": {
      "text": "Ver Alterações",
      "icon": "arrow_forward",
      "url": "{{missionUrl}}"
    },
    "footer": {
      "text": "Acesse a plataforma para mais detalhes.",
      "hint": "Em caso de dúvidas, entre em contato com o suporte."
    }
  }
}