{
  "id": "konquest_learning_trail_enrollment_expiring",
  "name": "Trilha Expirando em Breve",
  "category": "konquest",
  "subject": "Sua inscrição na trilha está expirando!",
  "header": {
    "icon": "schedule",
    "iconSize": 48,
    "title": "Olá, {{userName}}!",
    "subtitle": null
  },
  "content": {
    "intro": "Sua inscrição na trilha \"{{trailName}}\" está próxima de expirar. Termine as missões restantes antes do prazo.",
    "sections": [
      {
        "type": "info-card",
        "title": "Detalhes da trilha",
        "items": [
          {
            "icon": "route",
            "label": "Trilha",
            "value": "Trilha Comercial | Excelência em Vendas Consultivas"
          },
          {
            "icon": "calendar_today",
            "label": "Início em",
            "value": "05/01/2026"
          },
          {
            "icon": "calendar_today",
            "label": "Expira em",
            "value": "23/01/2026"
          },
          {
            "icon": "schedule",
            "label": "Status",
            "value": "Expira em 5 dias"
          }
        ]
      }
    ],
    "cta": {
      "text": "Ver Trilha",
      "icon": "arrow_forward",
      "url": "{{trailUrl}}"
    },
    "footer": {
      "text": "Acesse a plataforma para mais detalhes.",
      "hint": "Em caso de dúvidas, entre em contato com o suporte."
    }
  }
}