{
  "id": "analytics_new_report",
  "name": "Relatório Gerado com Sucesso",
  "category": "analytics",
  "subject": "Seu relatório está pronto!",
  
  "header": {
    "icon": "analytics",
    "iconSize": 48,
    "title": "Relatório Gerado com Sucesso",
    "subtitle": null
  },
  
  "content": {
    "intro": "Seu relatório solicitado \"{{reportName}}\" foi gerado e está pronto para download.",
    
    "sections": [
      {
        "type": "info-card",
        "items": [
          { "icon": "description", "label": "Nome do arquivo", "value": "{{fileName}}" },
          { "icon": "calendar_today", "label": "Gerado em", "value": "{{generatedDate}}" },
          { "icon": "person", "label": "Solicitado por", "value": "{{requesterName}}" }
        ]
      }
    ],
    
    "cta": {
      "text": "Baixar Relatório",
      "icon": "download",
      "url": "{{downloadUrl}}"
    },
    
    "footer": {
      "text": "Este link expira em 7 dias.",
      "hint": "Se você tiver problemas para baixar, entre em contato com o suporte."
    }
  }
}
