{
  "id": "konquest_user_enrolled_in_a_course_with_deadline",
  "name": "Inscrição em Curso com Prazo",
  "category": "konquest",
  "subject": "Você foi inscrito em um curso!",
  "header": {
    "icon": "menu_book",
    "iconSize": 48,
    "title": "Olá, {{userName}}!",
    "subtitle": null
  },
  "content": {
    "intro": "Você foi inscrito(a) no curso \"{{courseName}}\". Complete até {{deadline}}.",
    "sections": [
      {
        "type": "info-card",
        "title": "Detalles del curso",
        "items": [
          {
            "icon": "menu_book",
            "label": "Curso",
            "value": "Onboarding institucional Colombia - Panama - México"
          },
          {
            "icon": "calendar_today",
            "label": "Empieza en",
            "value": "22/01/2026"
          },
          {
            "icon": "calendar_today",
            "label": "Expira en",
            "value": "27/02/2026"
          },
          {
            "icon": "schedule",
            "label": "Expira en",
            "value": "36 dias"
          }
        ]
      }
    ],
    "cta": {
      "text": "Acessar Curso",
      "icon": "arrow_forward",
      "url": "{{courseUrl}}"
    },
    "footer": {
      "text": "Acesse a plataforma para mais detalhes.",
      "hint": "Em caso de dúvidas, entre em contato com o suporte."
    }
  }
}