{
  "id": "konquest_presential_enrollment_accepted",
  "name": "Inscrição Presencial Aceita",
  "category": "konquest",
  "subject": "Sua inscrição presencial foi aceita!",
  "header": {
    "icon": "check_circle",
    "iconSize": 48,
    "title": "Olá, {{userName}}!",
    "subtitle": null
  },
  "content": {
    "intro": "Sua inscrição na missão presencial \"{{missionName}}\" foi aceita!",
    "sections": [
      {
        "type": "info-card",
        "title": "Detalhes do evento presencial",
        "items": [
          {
            "icon": "event",
            "label": "Evento",
            "value": "Imersão em T&D da Keeps"
          },
          {
            "icon": "location_on",
            "label": "Local",
            "value": "Keeps - SC-401, 4120 - Km4 - Saco Grande, Florianópolis - SC, 88032-005"
          },
          {
            "icon": "calendar_today",
            "label": "Data",
            "value": "16/10/2025"
          },
          {
            "icon": "schedule",
            "label": "Horário",
            "value": "12:00:00"
          },
          {
            "icon": "group",
            "label": "Vagas/Participantes",
            "value": "70"
          }
        ]
      }
    ],
    "cta": {
      "text": "Ver Detalhes",
      "icon": "groups",
      "url": "{{missionUrl}}"
    },
    "footer": {
      "text": "Acesse a plataforma para mais detalhes.",
      "hint": "Em caso de dúvidas, entre em contato com o suporte."
    }
  }
}