{
  "id": "konquest_live_mission_starts_soon",
  "name": "Missão Live Começa em Breve",
  "category": "konquest",
  "subject": "Sua missão live começa em breve!",
  "header": {
    "icon": "schedule",
    "iconSize": 48,
    "title": "Olá, {{userName}}!",
    "subtitle": null
  },
  "content": {
    "intro": "A missão live \"{{missionName}}\" começa em {{startTime}}. Não se esqueça!",
    "sections": [
      {
        "type": "info-card",
        "title": "Detalhes do evento online",
        "items": [
          {
            "icon": "videocam",
            "label": "Evento",
            "value": "evento matriculas usuarios"
          },
          {
            "icon": "link",
            "label": "Link",
            "value": "click here (Google Meet)"
          },
          {
            "icon": "calendar_today",
            "label": "Data",
            "value": "01/12/2025"
          },
          {
            "icon": "schedule",
            "label": "Horário",
            "value": "16:00:00"
          }
        ]
      }
    ],
    "cta": {
      "text": "Acessar Missão",
      "icon": "videocam",
      "url": "{{missionUrl}}"
    },
    "footer": {
      "text": "Acesse a plataforma para mais detalhes.",
      "hint": "Em caso de dúvidas, entre em contato com o suporte."
    }
  }
}