{
  "id": "konquest_user_enrolled_in_a_course_with_deadline",
  "name": "Inscrição em Curso com Prazo",
  "category": "konquest",
  "subject": "Você foi inscrito em um curso!",
  "header": {
    "icon": "menu_book",
    "iconSize": 48,
    "title": "Olá, {{userName}}!",
    "subtitle": null
  },
  "content": {
    "intro": "Você foi inscrito(a) no curso \"{{courseName}}\". Complete até {{deadline}}.",
    "sections": [],
    "cta": {
      "text": "Acessar Curso",
      "icon": "arrow_forward",
      "url": "{{courseUrl}}"
    },
    "footer": {
      "text": "Acesse a plataforma para mais detalhes.",
      "hint": "Em caso de dúvidas, entre em contato com o suporte."
    }
  }
}