{
  "id": "konquest_onboarding",
  "name": "Bem-vindo à Plataforma",
  "category": "konquest",
  "subject": "Bem-vindo(a) à plataforma!",
  "header": {
    "icon": "waving_hand",
    "iconSize": 48,
    "title": "Bem-vindo a Bordo, {{userName}}!",
    "subtitle": null
  },
  "content": {
    "intro": "Você está sendo convidado(a) para acessar a plataforma de aprendizagem da {{companyName}}! Com esse convite, você terá acesso a vários conteúdos e também poderá compartilhar seus conhecimentos e habilidades com outras pessoas.",
    "sections": [
      {
        "type": "info-card",
        "title": "Credenciais de acesso",
        "items": [
          {
            "icon": "person",
            "label": "Usuário",
            "value": "adrianiperrella@gmail.com"
          },
          {
            "icon": "key",
            "label": "Senha",
            "value": "60313954"
          }
        ]
      }
    ],
    "cta": {
      "text": "Começar Agora",
      "icon": "arrow_forward",
      "url": "{{onboardingUrl}}"
    },
    "footer": {
      "text": "Acesse a plataforma para mais detalhes.",
      "hint": "Em caso de dúvidas, entre em contato com o suporte."
    }
  }
}