{
  "id": "konquest_user_enrolled_in_a_trail",
  "name": "Inscrição em Trilha",
  "category": "konquest",
  "subject": "Você foi inscrito em uma trilha!",
  "header": {
    "icon": "route",
    "iconSize": 48,
    "title": "Olá, {{userName}}!",
    "subtitle": null
  },
  "content": {
    "intro": "Você foi inscrito(a) na trilha \"{{trailName}}\". Comece sua jornada de aprendizado!",
    "sections": [
      {
        "type": "info-card",
        "title": "Detalhes da matrícula",
        "items": [
          {
            "icon": "menu_book",
            "label": "Curso",
            "value": "Áreas de Supply Chain"
          },
          {
            "icon": "calendar_today",
            "label": "Início em",
            "value": "22/01/2026"
          }
        ]
      }
    ],
    "cta": {
      "text": "Acessar Trilha",
      "icon": "arrow_forward",
      "url": "{{trailUrl}}"
    },
    "footer": {
      "text": "Acesse a plataforma para mais detalhes.",
      "hint": "Em caso de dúvidas, entre em contato com o suporte."
    }
  }
}